{
 "_doc": "UCG competition levels: which code values a skill and which element group it counts in. To re-value a catalog element at a level, take the first code in `value_codes` that has a record for the element (codes are listed in priority order); a skill with none of them is not creditable at that level. `eg` says how to turn that code's element group into the level's group. Sources: UCG Women's Rules v6.0 (2026-27), UCG Infinity (Open Scoring Level) Rules v1.2, UCG MAG Rules Policy and Rules Breakdown 2026-2028, UCG Masters Rules Policy (UCG Google Docs/Sheets, the sources of record: links in rules/README.md; digests in rules/UCG-*), and the routine planner's scoring code (js/scoring/wag.js), which implements them. `planner_id` is the routine planner's level ID.",
 "version": "2026-10-20",
 "_version_doc": "Date of the last change to this file; bump it whenever a level, code priority or EG map changes.",
 "WAG": {
  "silver": {
   "name": "Xcel Silver",
   "planner_id": "silver",
   "value_codes": [
    "USAG-XCEL-2022",
    "UCG-WAG-ADD"
   ],
   "eg": {
    "from": "USAG"
   },
   "note": "Xcel Silver requirements and difficulty restrictions; division-limited elements as listed in Xcel."
  },
  "gold": {
   "name": "Xcel Gold",
   "planner_id": "gold",
   "value_codes": [
    "USAG-XCEL-2022",
    "UCG-WAG-ADD"
   ],
   "eg": {
    "from": "USAG"
   },
   "note": "Xcel Gold requirements and difficulty restrictions."
  },
  "platinum": {
   "name": "Xcel Platinum",
   "planner_id": "plat",
   "value_codes": [
    "USAG-XCEL-2022",
    "UCG-WAG-ADD"
   ],
   "eg": {
    "from": "USAG"
   },
   "note": "Xcel Platinum requirements and difficulty restrictions."
  },
  "diamond": {
   "name": "Xcel Diamond",
   "planner_id": "diamond",
   "value_codes": [
    "USAG-XCEL-2022",
    "UCG-WAG-ADD"
   ],
   "eg": {
    "from": "USAG"
   },
   "note": "Xcel Diamond requirements and difficulty restrictions."
  },
  "sapphire": {
   "name": "Xcel Sapphire",
   "planner_id": "sapphire",
   "value_codes": [
    "USAG-XCEL-2022",
    "USAG-DP-2026",
    "UCG-WAG-ADD"
   ],
   "eg": {
    "from": "USAG"
   },
   "note": "No difficulty restrictions (unlimited D/E): Development Program E elements count (Women's Rules II.B.1). Vaults in the USAG Level 9/10 table but not the Xcel Sapphire table are allowed at 10.0 (II.B.2)."
  },
  "infinity": {
   "name": "UCG Infinity (Open Scoring Level)",
   "planner_id": "inf",
   "value_codes": [
    "USAG-DP-2026",
    "USAG-XCEL-2022",
    "UCG-WAG-ADD"
   ],
   "values": {
    "A": 0.1,
    "B": 0.3,
    "C": 0.5,
    "D": 0.7,
    "E": 0.9
   },
   "eg": {
    "from": "USAG",
    "condensed": {
     "UB": {
      "I": [
       "1",
       "8"
      ],
      "II": [
       "2"
      ],
      "III": [
       "3",
       "6",
       "7"
      ],
      "IV": [
       "4",
       "5"
      ]
     },
     "BB": {
      "I": [
       "1",
       "9"
      ],
      "II": [
       "2",
       "3"
      ],
      "III": [
       "4",
       "5",
       "6"
      ],
      "IV": [
       "7",
       "8"
      ]
     },
     "FX": {
      "I": [
       "1",
       "2"
      ],
      "II": [
       "3",
       "4",
       "5"
      ],
      "III": [
       "6",
       "7"
      ],
      "IV": [
       "8"
      ]
     }
    }
   },
   "note": "Any Development Program, Xcel Sapphire or UCG skill at its existing value; the 8 highest count; each element earns credit once. Vault uses the Open level's own vault chart (by name), not a code value."
  },
  "masters": {
   "name": "WAG Masters",
   "planner_id": "masters",
   "value_codes": [
    "WG-WAG-2025",
    "UCG-MASTERS-WAG"
   ],
   "eg": {
    "from": "WG",
    "note": "No element groups at Masters WAG since 2026-10-20: the international Composition Requirements CR I-V replace the condensed groups (rules/UCG-MASTERS/digest/scoring.json WAG.composition_requirements). The WG group number is kept as a fact for CR detection; UCG Masters additions carry no group (element_group \"\")."
   },
   "note": "WG letters (and Masters ME / GE), valued by the gymnast's age decade; Composition Requirements, not element groups (UCG Masters Rules Policy v2.1; planner masters.js, wag.js)."
  }
 },
 "MAG": {
  "developmental": {
   "name": "UCG Developmental",
   "planner_id": "dev",
   "value_codes": [
    "WG-MAG-2025",
    "UCG-MAG-ADD"
   ],
   "eg": {
    "from": "code"
   },
   "note": "WG + UCG MAG rules; no flipping or round-off-entry vaults."
  },
  "intermediate": {
   "name": "UCG Intermediate",
   "planner_id": "int",
   "value_codes": [
    "WG-MAG-2025",
    "UCG-MAG-ADD"
   ],
   "eg": {
    "from": "code"
   }
  },
  "advanced": {
   "name": "UCG Advanced (GymACT)",
   "planner_id": "adv",
   "value_codes": [
    "WG-MAG-2025",
    "UCG-MAG-ADD"
   ],
   "eg": {
    "from": "code"
   },
   "note": "GymACT rules; some front-handspring vaults are worth more than in WG, at Advanced only (rules/UCG-MAG/digest/vault.json; planner ADV_VAULT)."
  },
  "masters": {
   "name": "MAG Masters",
   "planner_id": "masters",
   "value_codes": [
    "WG-MAG-2025",
    "UCG-MASTERS-MAG"
   ],
   "eg": {
    "from": "code"
   },
   "note": "WG letters (and Masters ME / GE), valued by age decade (GE replaced Misc. on 2026-10-20)."
  }
 }
}
